<?xml version="1.0" encoding="UTF-8"?>
<schema xmlns="http://www.w3.org/2001/XMLSchema" targetNamespace="stendhal"
	xmlns:tns="http://www.example.org/zones" elementFormDefault="qualified"
	xmlns:Q1="stendhal">

	<element name="achievements" type="Q1:achievementsGroup"></element>

	<complexType name="achievementsGroup">
		<sequence>
			<element name="achievement" type="Q1:achievementType" minOccurs="0"
				maxOccurs="unbounded"></element>
		</sequence>
	</complexType>

	<complexType name="itemType">
		<sequence>
			<element name="type" type="Q1:typeType" />
			<element name="implementation" type="Q1:implementation"></element>
			<element name="attributes" type="Q1:attributes"></element>
		</sequence>
		<attribute name="name" type="string" use="required"></attribute>
	</complexType>

	<complexType name="typeType">
		<attribute name="class" type="string"></attribute>
		<attribute name="subclass" type="string"></attribute>
		<attribute name="tileid" type="int"></attribute>
	</complexType>

	<complexType name="implementation">
		<attribute name="class-name" type="string"></attribute>
	</complexType>

	<complexType name="pair">
		<attribute name="name" type="string"/>
		<attribute name="value" type="string"/>
	</complexType>

	<complexType name="attributes">
		<sequence>
			<element name="identifier" type="Q1:attribute" minOccurs="0"/>
			<element name="title" type="Q1:attribute" minOccurs="0"/>
			<element name="description" type="Q1:attribute" minOccurs="0"/>
			<element name="score" type="Q1:attribute" minOccurs="0"/>
			<element name="active" type="Q1:attribute" minOccurs="0"/>
			<element name="condition" type="Q1:attribute" minOccurs="0"/>
		</sequence>
	</complexType>

	<complexType name="attribute">
		<attribute name="value" type="string"></attribute>
	</complexType>

</schema>
