<?xml version="1.0" encoding="UTF-8"?>
<achievements xmlns="stendhal" xmlns:xsi="http://www.w3.org/2001/XMLSchema-instance"
	xsi:schemaLocation="stendhal ../achievements.xsd ">
	
	<achievement name="semos">
		<type class="achievements" subclass="interior_zone" tileid="-1"/>
		<implementation class-name="games.stendhal.server.InteriorZoneAchievementFactory"/>
		<attributes>
			<identifier value = "zone.interior.semos" />
			<title value = "Home maker" />
			<description value = "Visit all interior zones in the Semos region" />
			<score value = "2" />
			<active value = "true" />
			<condition value = "new PlayerVisitedZonesInRegionCondition('semos', Boolean.FALSE, Boolean.FALSE)" />
		</attributes>
	</achievement>
	
	<achievement name="nalwor">
		<type class="achievements" subclass="interior_zone" tileid="-1"/>
		<implementation class-name="games.stendhal.server.InteriorZoneAchievementFactory"/>
		<attributes>
			<identifier value = "zone.interior.nalwor" />
			<title value = "Elf visitor" />
			<description value = "Visit all interior zones in the Nalwor region" />
			<score value = "2" />
			<active value = "true" />
			<condition value = "new PlayerVisitedZonesInRegionCondition('nalwor', Boolean.FALSE, Boolean.FALSE)" />
		</attributes>
	</achievement>
	
	<achievement name="ados">
		<type class="achievements" subclass="interior_zone" tileid="-1"/>
		<implementation class-name="games.stendhal.server.InteriorZoneAchievementFactory"/>
		<attributes>
			<identifier value = "zone.interior.ados" />
			<title value = "Up town guy" />
			<description value = "Visit all accessible interior zones in the Ados region" />
			<score value = "2" />
			<active value = "true" />
			<condition value = "new PlayerVisitedZonesInRegionCondition('ados', Boolean.FALSE, Boolean.FALSE)" />
		</attributes>
	</achievement>

	<achievement name="wofol">
		<type class="achievements" subclass="interior_zone" tileid="-1"/>
		<implementation class-name="games.stendhal.server.InteriorZoneAchievementFactory"/>
		<attributes>
			<identifier value = "zone.interior.wofolcity" />
			<title value = "Kobold City" />
			<description value = "Visit all interior zones in Wo'lof" />
			<score value = "2" />
			<active value = "true" />
			<condition value = "new PlayerVisitedZonesInRegionCondition('wofol city', Boolean.FALSE, Boolean.FALSE)" />
		</attributes>
	</achievement>

	<achievement name="magic">
		<type class="achievements" subclass="interior_zone" tileid="-1"/>
		<implementation class-name="games.stendhal.server.InteriorZoneAchievementFactory"/>
		<attributes>
			<identifier value = "zone.interior.magiccity" />
			<title value = "Magic City" />
			<description value = "Visit all interior zones in the underground Magic city" />
			<score value = "2" />
			<active value = "true" />
			<condition value = "new PlayerVisitedZonesInRegionCondition('magic city', Boolean.FALSE, Boolean.FALSE)" />
		</attributes>
	</achievement>
</achievements>