<?xml version="1.0" encoding="UTF-8"?>
<achievements xmlns="stendhal" xmlns:xsi="http://www.w3.org/2001/XMLSchema-instance"
	xsi:schemaLocation="stendhal ../achievements.xsd ">
	
	<achievement name="wish">
		<type class="achievements" subclass="obtain" tileid="-1"/>
		<implementation class-name="games.stendhal.server.ObtainAchievementsFactory"/>
		<attributes>
			<identifier value = "obtain.wish" />
			<title value = "A wish came true" />
			<description value = "Get an item from the wishing well" />
			<score value = "1" />
			<active value = "true" />
			<condition value = "new PlayerGotNumberOfItemsFromWellCondition(0)" />
		</attributes>
	</achievement>
	
	<achievement name="vegetable">
		<type class="achievements" subclass="obtain" tileid="-1"/>
		<implementation class-name="games.stendhal.server.ObtainAchievementsFactory"/>
		<attributes>
			<identifier value = "obtain.harvest.vegetable" />
			<title value = "Farmer" />
			<description value = "Harvest 3 of all vegetables that grow in Faiumoni" />
			<score value = "1" />
			<active value = "true" />
			<condition value = "new PlayerHasHarvestedNumberOfItemsCondition(3, 'carrot', 'salad', 'broccoli', 'cauliflower', 'leek',
						'onion', 'courgette', 'spinach', 'collard', 'garlic', 'artichoke')" />
		</attributes>
	</achievement>

	<achievement name="fishing">
		<type class="achievements" subclass="obtain" tileid="-1"/>
		<implementation class-name="games.stendhal.server.ObtainAchievementsFactory"/>
		<attributes>
			<identifier value = "obtain.fish" />
			<title value = "Fisherman" />
			<description value = "Catch 15 of each type of fish" />
			<score value = "2" />
			<active value = "true" />
			<condition value = "new PlayerHasHarvestedNumberOfItemsCondition(15, 'char', 'clownfish', 'cod', 'mackerel', 'perch',
						'red lionfish', 'roach', 'surgeonfish', 'trout')" />
		</attributes>
	</achievement>
	
	<achievement name="quest">
		<type class="achievements" subclass="obtain" tileid="-1"/>
		<implementation class-name="games.stendhal.server.ObtainAchievementsFactory"/>
		<attributes>
			<identifier value = "quest.special.collector" />
			<title value = "Ultimate Collector" />
			<description value = "Finish ultimate collector quest" />
			<score value = "5" />
			<active value = "true" />
			<condition value = "new QuestCompletedCondition('ultimate_collector')" />
		</attributes>
	</achievement>
	
</achievements>