<?xml version="1.0" encoding="UTF-8"?>
<achievements xmlns="stendhal" xmlns:xsi="http://www.w3.org/2001/XMLSchema-instance"
	xsi:schemaLocation="stendhal ../achievements.xsd ">
	
	<achievement name="Semos' Protector">
	  	<type class="achievements" subclass="quest_semos_monster" tileid="-1"/>
		<implementation class-name="games.stendhal.server.entity.core.rp.achievement.factory.SemosMonsterQuestAchievementFactory"/>
		<attributes>
			<identifier value="quest.special.daily.0010"/>
			<title value="Semos' Protector"/>
			<description value="Finish daily monster quest 10 times"/>
			<score value="1"/>
			<active value="true"/>
			<condition value="new QuestStateGreaterThanCondition('daily', 2, 9)"/>
		</attributes>
	</achievement>
	
	<achievement name="Semos' Guardian">
	  	<type class="achievements" subclass="quest_semos_monster" tileid="-1"/>
		<implementation class-name="games.stendhal.server.entity.core.rp.achievement.factory.SemosMonsterQuestAchievementFactory"/>
		<attributes>
			<identifier value="quest.special.daily.0050"/>
			<title value="Semos' Guardian"/>
			<description value="Finish daily monster quest 50 times"/>
			<score value="1"/>
			<active value="true"/>
			<condition value="new QuestStateGreaterThanCondition('daily', 2, 49)"/>
		</attributes>
	</achievement>
	
	<achievement name="Semos' Hero">
	  	<type class="achievements" subclass="quest_semos_monster" tileid="-1"/>
		<implementation class-name="games.stendhal.server.entity.core.rp.achievement.factory.SemosMonsterQuestAchievementFactory"/>
		<attributes>
			<identifier value="quest.special.daily.0100"/>
			<title value="Semos' Hero"/>
			<description value="Finish daily monster quest 100 times"/>
			<score value="2"/>
			<active value="true"/>
			<condition value="new QuestStateGreaterThanCondition('daily', 2, 99)"/>
		</attributes>
	</achievement>
	
	<achievement name="Semos' Champion">
	  	<type class="achievements" subclass="quest_semos_monster" tileid="-1"/>
		<implementation class-name="games.stendhal.server.entity.core.rp.achievement.factory.SemosMonsterQuestAchievementFactory"/>
		<attributes>
			<identifier value="quest.special.daily.0250"/>
			<title value="Semos' Champion"/>
			<description value="Finish daily monster quest 250 times"/>
			<score value="2"/>
			<active value="true"/>
			<condition value="new QuestStateGreaterThanCondition('daily', 2, 249)"/>
		</attributes>
	</achievement>
	
	<achievement name="Semos' Vanquisher">
	  	<type class="achievements" subclass="quest_semos_monster" tileid="-1"/>
		<implementation class-name="games.stendhal.server.entity.core.rp.achievement.factory.SemosMonsterQuestAchievementFactory"/>
		<attributes>
			<identifier value="quest.special.daily.0500"/>
			<title value="Semos' Vanquisher"/>
			<description value="Finish daily monster quest 500 times"/>
			<score value="5"/>
			<active value="true"/>
			<condition value="new QuestStateGreaterThanCondition('daily', 2, 499)"/>
		</attributes>
	</achievement>
	
</achievements>