<?xml version="1.0" encoding="UTF-8"?>
<achievements xmlns="stendhal" xmlns:xsi="http://www.w3.org/2001/XMLSchema-instance"
	xsi:schemaLocation="stendhal ../achievements.xsd ">
	
	<achievement name="supporter">
		<type class="achievements" subclass="quest_ados_items" tileid="-1"/>
		<implementation class-name="games.stendhal.server.AdosItemQuestAchievementsFactory"/>
		<attributes>
			<identifier value = "quest.special.daily_item.0010" />
			<title value = "Ados' Supporter" />
			<description value = "Finish daily item quest 10 times" />
			<score value = "1" />
			<active value = "true" />
			<condition value = "new QuestStateGreaterThanCondition('daily_item', 2, 9)" />
		</attributes>
	</achievement>
	
	<achievement name="provider">
		<type class="achievements" subclass="quest_ados_items" tileid="-1"/>
		<implementation class-name="games.stendhal.server.AdosItemQuestAchievementsFactory"/>
		<attributes>
			<identifier value = "quest.special.daily_item.0050" />
			<title value = "Ados' Provider" />
			<description value = "Finish daily item quest 50 times" />
			<score value = "1" />
			<active value = "true" />
			<condition value = "new QuestStateGreaterThanCondition('daily_item', 2, 49)" />
		</attributes>
	</achievement>
	
	<achievement name="supplier">
		<type class="achievements" subclass="quest_ados_items" tileid="-1"/>
		<implementation class-name="games.stendhal.server.AdosItemQuestAchievementsFactory"/>
		<attributes>
			<identifier value = "quest.special.daily_item.0100" />
			<title value = "Ados' Supplier" />
			<description value = "Finish daily item quest 100 times" />
			<score value = "2" />
			<active value = "true" />
			<condition value = "new QuestStateGreaterThanCondition('daily_item', 2, 99)" />
		</attributes>
	</achievement>

	<achievement name="stockpiler">
		<type class="achievements" subclass="quest_ados_items" tileid="-1"/>
		<implementation class-name="games.stendhal.server.AdosItemQuestAchievementsFactory"/>
		<attributes>
			<identifier value = "quest.special.daily_item.0250" />
			<title value = "Ados' Stockpiler" />
			<description value = "Finish daily item quest 250 times" />
			<score value = "2" />
			<active value = "true" />
			<condition value = "new QuestStateGreaterThanCondition('daily_item', 2, 249)" />
		</attributes>
	</achievement>

	<achievement name="hoarder">
		<type class="achievements" subclass="quest_ados_items" tileid="-1"/>
		<implementation class-name="games.stendhal.server.AdosItemQuestAchievementsFactory"/>
		<attributes>
			<identifier value = "quest.special.daily_item.0500" />
			<title value = "Ados' Hoarder" />
			<description value = "Finish daily item quest 500 times" />
			<score value = "5" />
			<active value = "true" />
			<condition value = "new QuestStateGreaterThanCondition('daily_item', 2, 499)" />
		</attributes>
	</achievement>
</achievements>