<?xml version="1.0" encoding="UTF-8"?>
<achievements xmlns="stendhal" xmlns:xsi="http://www.w3.org/2001/XMLSchema-instance"
	xsi:schemaLocation="stendhal ../achievements.xsd ">
	
	<achievement name="Sergeanttest">
	  	<type class="achievements" subclass="quest_mithrilbourgh_enemy_army" tileid="-1"/>
		<implementation class-name="games.stendhal.server.entity.core.rp.achievement.factory.MithrilbourghEnemyArmyAchievementFactory"/>
		<attributes>
			<identifier value="quest.special.kill_enemy_army.0005"/>
			<title value="Sergeant"/>
			<description value="Finish Kill Enemy Army quest 5 times"/>
			<score value="2"/>
			<active value="true"/>
			<condition value="new QuestStateGreaterThanCondition('kill_enemy_army', IDX, 4)"/>
		</attributes>
	</achievement>

	<achievement name="Majortest">
	  	<type class="achievements" subclass="quest_mithrilbourgh_enemy_army" tileid="-1"/>
		<implementation class-name="games.stendhal.server.entity.core.rp.achievement.factory.MithrilbourghEnemyArmyAchievementFactory"/>
		<attributes>
			<identifier value="quest.special.kill_enemy_army.0025"/>
			<title value="Major"/>
			<description value="Finish Kill Enemy Army quest 25 times"/>
			<score value="5"/>
			<active value="true"/>
			<condition value="new QuestStateGreaterThanCondition('kill_enemy_army', IDX, 24)"/>
		</attributes>
	</achievement>
	
	<achievement name="Field Marshaltest">
	  	<type class="achievements" subclass="quest_mithrilbourgh_enemy_army" tileid="-1"/>
		<implementation class-name="games.stendhal.server.entity.core.rp.achievement.factory.MithrilbourghEnemyArmyAchievementFactory"/>
		<attributes>
			<identifier value="quest.special.kill_enemy_army.0100"/>
			<title value="Major General"/>
			<description value="Finish Kill Enemy Army quest 100 times"/>
			<score value="5"/>
			<active value="true"/>
			<condition value="new QuestStateGreaterThanCondition('kill_enemy_army', IDX, 99)"/>
		</attributes>
	</achievement>
	

</achievements>
